"QID","Question","RightAnswer","WrongAnswer1","WrongAnswer2","WrongAnswer3","QLevel"
1,Đâu không phải động vật có sừng,Sư Tử,Linh Dương,Trâu,Tuần Lộc,5
2,"Trong câu chuyện cổ tích, phù thủy đi lại bằng phương tiện nào",Cưỡi chổi,Cưỡi mây,Cưỡi tuần lộc,Cưỡi Thảm bay,5
3,Loài chim nào sau đây có thể bắt chước tiếng người,Vẹt,Quạ,Chim Sẻ,Chích Bông,5
6,Cho đến nay từ Tiếng Việt nào chưa nằm trong từ điển Oxford,Nem,Bánh mỳ,Áo dài,Phở,5
12,Sazae-san là bộ phim dài nhất thế giới thuộc thể loại nào?,Hoạt Hình ,Kinh dị,Trinh thám,Hành động,5
